[
  {
    "registry_id": "ecfspr",
    "report_title": "ECFSPR Annual Report 2020",
    "report_year": 2020,
    "page_number": 11,
    "page": 11,
    "url": "https://pr.ecfs.eu/wp-content/uploads/2025/06/ECFSPR_Report_2020_v1.0-07Jun2022_website.pdf",
    "source_sha256": "6f0430d66af114c2770e3cffb28273163c22d35c7d45cf15dbab297df06624c8",
    "table_id": "Summary of data report",
    "extraction_kind": "observed",
    "row_id": "ECFSPR-2020-P11-R01",
    "indicator_id": "pwcf_registered",
    "indicator_name": "Patients registered in the ECFSPR",
    "stratum_sex": "females",
    "count_n": 24799,
    "percentage": 47.5,
    "denominator_n": 52246,
    "value_point": null,
    "value_low": null,
    "value_high": null,
    "median_iqr": null,
    "unit": "count_and_percentage",
    "raw_text_quote": "24799 (47.5%)",
    "notes": "Registered cohort 2020."
  },
  {
    "registry_id": "ecfspr",
    "report_title": "ECFSPR Annual Report 2020",
    "report_year": 2020,
    "page_number": 11,
    "page": 11,
    "url": "https://pr.ecfs.eu/wp-content/uploads/2025/06/ECFSPR_Report_2020_v1.0-07Jun2022_website.pdf",
    "source_sha256": "6f0430d66af114c2770e3cffb28273163c22d35c7d45cf15dbab297df06624c8",
    "table_id": "Summary of data report",
    "extraction_kind": "observed",
    "row_id": "ECFSPR-2020-P11-R02",
    "indicator_id": "pwcf_registered",
    "indicator_name": "Patients registered in the ECFSPR",
    "stratum_sex": "males",
    "count_n": 27447,
    "percentage": 52.5,
    "denominator_n": 52246,
    "value_point": null,
    "value_low": null,
    "value_high": null,
    "median_iqr": null,
    "unit": "count_and_percentage",
    "raw_text_quote": "27447 (52.5%)",
    "notes": "Registered cohort 2020."
  },
  {
    "registry_id": "ecfspr",
    "report_title": "ECFSPR Annual Report 2020",
    "report_year": 2020,
    "page_number": 11,
    "page": 11,
    "url": "https://pr.ecfs.eu/wp-content/uploads/2025/06/ECFSPR_Report_2020_v1.0-07Jun2022_website.pdf",
    "source_sha256": "6f0430d66af114c2770e3cffb28273163c22d35c7d45cf15dbab297df06624c8",
    "table_id": "Summary of data report",
    "extraction_kind": "observed",
    "row_id": "ECFSPR-2020-P11-R03",
    "indicator_id": "pwcf_registered",
    "indicator_name": "Patients registered in the ECFSPR",
    "stratum_sex": "total",
    "count_n": 52246,
    "percentage": null,
    "denominator_n": 52246,
    "value_point": null,
    "value_low": null,
    "value_high": null,
    "median_iqr": null,
    "unit": "count",
    "raw_text_quote": "52246",
    "notes": "Total registered cohort 2020."
  },
  {
    "registry_id": "ecfspr",
    "report_title": "ECFSPR Annual Report 2020",
    "report_year": 2020,
    "page_number": 11,
    "page": 11,
    "url": "https://pr.ecfs.eu/wp-content/uploads/2025/06/ECFSPR_Report_2020_v1.0-07Jun2022_website.pdf",
    "source_sha256": "6f0430d66af114c2770e3cffb28273163c22d35c7d45cf15dbab297df06624c8",
    "table_id": "Summary of data report",
    "extraction_kind": "observed",
    "row_id": "ECFSPR-2020-P11-R04",
    "indicator_id": "age_at_followup",
    "indicator_name": "Age at follow-up (in years; patients alive on 31/12/2020)",
    "stratum_sex": "females",
    "count_n": null,
    "percentage": null,
    "denominator_n": null,
    "value_point": 18.8,
    "value_low": null,
    "value_high": null,
    "median_iqr": null,
    "unit": "years",
    "raw_text_quote": "median 18.8",
    "notes": "Patients alive on 31/12/2020; mean 21.5."
  },
  {
    "registry_id": "ecfspr",
    "report_title": "ECFSPR Annual Report 2020",
    "report_year": 2020,
    "page_number": 11,
    "page": 11,
    "url": "https://pr.ecfs.eu/wp-content/uploads/2025/06/ECFSPR_Report_2020_v1.0-07Jun2022_website.pdf",
    "source_sha256": "6f0430d66af114c2770e3cffb28273163c22d35c7d45cf15dbab297df06624c8",
    "table_id": "Summary of data report",
    "extraction_kind": "observed",
    "row_id": "ECFSPR-2020-P11-R05",
    "indicator_id": "age_at_followup",
    "indicator_name": "Age at follow-up (in years; patients alive on 31/12/2020)",
    "stratum_sex": "males",
    "count_n": null,
    "percentage": null,
    "denominator_n": null,
    "value_point": 19.8,
    "value_low": null,
    "value_high": null,
    "median_iqr": null,
    "unit": "years",
    "raw_text_quote": "median 19.8",
    "notes": "Patients alive on 31/12/2020; mean 22.1."
  },
  {
    "registry_id": "ecfspr",
    "report_title": "ECFSPR Annual Report 2020",
    "report_year": 2020,
    "page_number": 11,
    "page": 11,
    "url": "https://pr.ecfs.eu/wp-content/uploads/2025/06/ECFSPR_Report_2020_v1.0-07Jun2022_website.pdf",
    "source_sha256": "6f0430d66af114c2770e3cffb28273163c22d35c7d45cf15dbab297df06624c8",
    "table_id": "Summary of data report",
    "extraction_kind": "observed",
    "row_id": "ECFSPR-2020-P11-R06",
    "indicator_id": "age_at_followup",
    "indicator_name": "Age at follow-up (in years; patients alive on 31/12/2020)",
    "stratum_sex": "total",
    "count_n": null,
    "percentage": null,
    "denominator_n": null,
    "value_point": 19.4,
    "value_low": null,
    "value_high": null,
    "median_iqr": null,
    "unit": "years",
    "raw_text_quote": "median 19.4",
    "notes": "Patients alive on 31/12/2020; mean 21.8."
  },
  {
    "registry_id": "ecfspr",
    "report_title": "ECFSPR Annual Report 2020",
    "report_year": 2020,
    "page_number": 11,
    "page": 11,
    "url": "https://pr.ecfs.eu/wp-content/uploads/2025/06/ECFSPR_Report_2020_v1.0-07Jun2022_website.pdf",
    "source_sha256": "6f0430d66af114c2770e3cffb28273163c22d35c7d45cf15dbab297df06624c8",
    "table_id": "Summary of data report",
    "extraction_kind": "observed",
    "row_id": "ECFSPR-2020-P11-R07",
    "indicator_id": "pwcf_adult_ge18",
    "indicator_name": "Patients >= 18 years (patients alive on 31/12/2020)",
    "stratum_sex": "females",
    "count_n": 12788,
    "percentage": 51.9,
    "denominator_n": 24799,
    "value_point": null,
    "value_low": null,
    "value_high": null,
    "median_iqr": null,
    "unit": "count_and_percentage",
    "raw_text_quote": "12788 (51.9%)",
    "notes": "Patients alive on 31/12/2020."
  },
  {
    "registry_id": "ecfspr",
    "report_title": "ECFSPR Annual Report 2020",
    "report_year": 2020,
    "page_number": 11,
    "page": 11,
    "url": "https://pr.ecfs.eu/wp-content/uploads/2025/06/ECFSPR_Report_2020_v1.0-07Jun2022_website.pdf",
    "source_sha256": "6f0430d66af114c2770e3cffb28273163c22d35c7d45cf15dbab297df06624c8",
    "table_id": "Summary of data report",
    "extraction_kind": "observed",
    "row_id": "ECFSPR-2020-P11-R08",
    "indicator_id": "pwcf_adult_ge18",
    "indicator_name": "Patients >= 18 years (patients alive on 31/12/2020)",
    "stratum_sex": "males",
    "count_n": 14780,
    "percentage": 54.2,
    "denominator_n": 27447,
    "value_point": null,
    "value_low": null,
    "value_high": null,
    "median_iqr": null,
    "unit": "count_and_percentage",
    "raw_text_quote": "14780 (54.2%)",
    "notes": "Patients alive on 31/12/2020."
  },
  {
    "registry_id": "ecfspr",
    "report_title": "ECFSPR Annual Report 2020",
    "report_year": 2020,
    "page_number": 11,
    "page": 11,
    "url": "https://pr.ecfs.eu/wp-content/uploads/2025/06/ECFSPR_Report_2020_v1.0-07Jun2022_website.pdf",
    "source_sha256": "6f0430d66af114c2770e3cffb28273163c22d35c7d45cf15dbab297df06624c8",
    "table_id": "Summary of data report",
    "extraction_kind": "observed",
    "row_id": "ECFSPR-2020-P11-R09",
    "indicator_id": "pwcf_adult_ge18",
    "indicator_name": "Patients >= 18 years (patients alive on 31/12/2020)",
    "stratum_sex": "total",
    "count_n": 27568,
    "percentage": 53.1,
    "denominator_n": 52246,
    "value_point": null,
    "value_low": null,
    "value_high": null,
    "median_iqr": null,
    "unit": "count_and_percentage",
    "raw_text_quote": "27568 (53.1%)",
    "notes": "Patients alive on 31/12/2020."
  },
  {
    "registry_id": "ecfspr",
    "report_title": "ECFSPR Annual Report 2020",
    "report_year": 2020,
    "page_number": 11,
    "page": 11,
    "url": "https://pr.ecfs.eu/wp-content/uploads/2025/06/ECFSPR_Report_2020_v1.0-07Jun2022_website.pdf",
    "source_sha256": "6f0430d66af114c2770e3cffb28273163c22d35c7d45cf15dbab297df06624c8",
    "table_id": "Summary of data report",
    "extraction_kind": "observed",
    "row_id": "ECFSPR-2020-P11-R10",
    "indicator_id": "age_at_diagnosis_months",
    "indicator_name": "Age at diagnosis (months)",
    "stratum_sex": "females",
    "count_n": null,
    "percentage": null,
    "denominator_n": null,
    "value_point": 3.6,
    "value_low": null,
    "value_high": null,
    "median_iqr": null,
    "unit": "months",
    "raw_text_quote": "median (months) 3.6",
    "notes": "* Only patients seen during the year are presented. The total number of patients presented is 49,111."
  },
  {
    "registry_id": "ecfspr",
    "report_title": "ECFSPR Annual Report 2020",
    "report_year": 2020,
    "page_number": 11,
    "page": 11,
    "url": "https://pr.ecfs.eu/wp-content/uploads/2025/06/ECFSPR_Report_2020_v1.0-07Jun2022_website.pdf",
    "source_sha256": "6f0430d66af114c2770e3cffb28273163c22d35c7d45cf15dbab297df06624c8",
    "table_id": "Summary of data report",
    "extraction_kind": "observed",
    "row_id": "ECFSPR-2020-P11-R11",
    "indicator_id": "age_at_diagnosis_months",
    "indicator_name": "Age at diagnosis (months)",
    "stratum_sex": "males",
    "count_n": null,
    "percentage": null,
    "denominator_n": null,
    "value_point": 3.6,
    "value_low": null,
    "value_high": null,
    "median_iqr": null,
    "unit": "months",
    "raw_text_quote": "median (months) 3.6",
    "notes": "* Only patients seen during the year are presented. The total number of patients presented is 49,111."
  },
  {
    "registry_id": "ecfspr",
    "report_title": "ECFSPR Annual Report 2020",
    "report_year": 2020,
    "page_number": 11,
    "page": 11,